{
  "assets": [],
  "diagnostics": [],
  "document_id": "screen-design",
  "metadata": {
    "asset_directory": "fixtures/assets",
    "creator": "Fixture Team",
    "ingestor": "openpyxl+ooxml",
    "last_modified_by": null,
    "template_match": {
      "candidates": [
        {
          "accepted": true,
          "score": 1.0,
          "template_id": "fixture-screen-design",
          "version": "1.0"
        }
      ],
      "mode": "template",
      "unrecognized_ranges": {
        "改訂履歴": [],
        "画面項目": [
          "A1:A1",
          "A7:A8",
          "B1:H8"
        ],
        "表紙": [
          "A12:A12",
          "A11:D12"
        ]
      }
    }
  },
  "schema_version": "1.0",
  "sheets": [
    {
      "assets": [
        {
          "anchor": "B13",
          "asset_id": "sheet-1-image-1",
          "asset_type": "image",
          "description": "Picture",
          "extraction_status": "extracted",
          "media_type": "image/png",
          "metadata": {
            "anchor_row": 13,
            "drawing_order": 1,
            "drawing_part": "xl/drawings/drawing1.xml",
            "ooxml_part": "xl/media/image1.png",
            "relationship_id": "rId1"
          },
          "source": {
            "sheet": "表紙",
            "workbook_path": "fixtures/workbooks/screen-design.xlsx"
          },
          "uri": "fixtures/assets/表紙-image-1.png"
        },
        {
          "anchor": "B13",
          "asset_id": "sheet-1-shape-1",
          "asset_type": "shape",
          "description": "検索ボタンで一覧を更新",
          "extraction_status": "extracted",
          "metadata": {
            "drawing_part": "xl/drawings/drawing1.xml",
            "shape_kind": "sp",
            "text": "検索ボタンで一覧を更新"
          },
          "source": {
            "sheet": "表紙",
            "workbook_path": "fixtures/workbooks/screen-design.xlsx"
          },
          "uri": "ooxml://xl/drawings/drawing1.xml#shape-1"
        },
        {
          "anchor": "B13:H24",
          "asset_id": "fixture-screen-shot",
          "asset_type": "layout",
          "description": "脱敏検索画面",
          "extraction_status": "bound",
          "media_type": "image/png",
          "metadata": {
            "manifest_path": "C:\\Users\\yuyuzeze\\Desktop\\Linye\\linyetools\\ExcelSpec\\tests\\fixtures\\screenshots.json",
            "ocr": {
              "status": "pending"
            },
            "region_id": null,
            "source_kind": "user_manifest",
            "vlm": {
              "status": "not_requested"
            }
          },
          "source": {
            "sheet": "表紙",
            "workbook_path": "fixtures/workbooks/screen-design.xlsx"
          },
          "uri": "fixtures/screens/layout.png"
        }
      ],
      "diagnostics": [],
      "index": 0,
      "metadata": {
        "effective_bounds": [
          1,
          1,
          12,
          4
        ],
        "extraction_mode": "template",
        "merged_ranges": [
          "A1:D1"
        ],
        "state": "visible"
      },
      "name": "表紙",
      "regions": [
        {
          "asset_ids": [],
          "confidence": 1.0,
          "metadata": {
            "extractor_kind": "key_value",
            "key_labels": {
              "作成日": "created_at",
              "作成者": "author",
              "画面ID": "screen_id",
              "画面名": "screen_name"
            },
            "shrink_to_content": false,
            "template_region_id": "document-info",
            "trim_empty_columns": false,
            "value_labels": {
              "author": "作成者",
              "created_at": "作成日",
              "screen_id": "画面ID",
              "screen_name": "画面名"
            }
          },
          "region_id": "document-info",
          "region_type": "key_value",
          "source": {
            "range": "A1:D10",
            "sheet": "表紙"
          },
          "tables": [],
          "title": "表紙",
          "values": {
            "author": "担当A",
            "created_at": "2026-01-15",
            "screen_id": "SCR-DEMO-001",
            "screen_name": "利用者検索",
            "画面設計書": ""
          }
        },
        {
          "asset_ids": [
            "fixture-screen-shot",
            "sheet-1-image-1",
            "sheet-1-shape-1"
          ],
          "confidence": 0.9,
          "metadata": {
            "extractor_kind": "asset",
            "shrink_to_content": false,
            "template_region_id": "screen-layout",
            "trim_empty_columns": false
          },
          "region_id": "screen-layout",
          "region_type": "layout",
          "source": {
            "range": "A13:H24",
            "sheet": "表紙"
          },
          "tables": [
            {
              "cells": [],
              "column_semantics": {},
              "header_rows": 0,
              "metadata": {},
              "source": {
                "range": "A13:H24",
                "sheet": "表紙"
              },
              "table_id": "screen-layout"
            }
          ],
          "title": "画面レイアウト",
          "values": {}
        },
        {
          "asset_ids": [],
          "confidence": 0.25,
          "metadata": {
            "segmentation": "blank-and-style-boundaries"
          },
          "region_id": "unrecognized-1",
          "region_type": "freeform",
          "source": {
            "range": "A12:A12",
            "sheet": "表紙"
          },
          "tables": [
            {
              "cells": [
                {
                  "col_span": 1,
                  "column": 1,
                  "coordinate": "A12",
                  "data_type": "s",
                  "display_value": "画面レイアウト",
                  "raw_value": "画面レイアウト",
                  "row": 12,
                  "row_span": 1,
                  "source": {
                    "cell": "A12",
                    "sheet": "表紙",
                    "workbook_path": "fixtures/workbooks/screen-design.xlsx"
                  },
                  "style": {
                    "alignment": {},
                    "border": {},
                    "fill": {
                      "background": {
                        "type": "rgb",
                        "value": "00000000"
                      },
                      "foreground": {
                        "type": "rgb",
                        "value": "00000000"
                      }
                    },
                    "font": {
                      "bold": true
                    },
                    "number_format": "General"
                  }
                }
              ],
              "column_semantics": {},
              "header_rows": 0,
              "metadata": {},
              "source": {
                "range": "A12:A12",
                "sheet": "表紙"
              },
              "table_id": "unrecognized-1"
            }
          ],
          "values": {}
        },
        {
          "asset_ids": [],
          "confidence": 0.1,
          "metadata": {
            "reason": "preserve-empty-or-separated-effective-cells",
            "segmentation": "grid-residual"
          },
          "region_id": "unrecognized-grid-residual",
          "region_type": "freeform",
          "source": {
            "range": "A11:D12",
            "sheet": "表紙"
          },
          "tables": [
            {
              "cells": [
                {
                  "col_span": 1,
                  "column": 1,
                  "coordinate": "A11",
                  "data_type": "n",
                  "row": 11,
                  "row_span": 1,
                  "source": {
                    "cell": "A11",
                    "sheet": "表紙",
                    "workbook_path": "fixtures/workbooks/screen-design.xlsx"
                  }
                },
                {
                  "col_span": 1,
                  "column": 2,
                  "coordinate": "B11",
                  "data_type": "n",
                  "row": 11,
                  "row_span": 1,
                  "source": {
                    "cell": "B11",
                    "sheet": "表紙",
                    "workbook_path": "fixtures/workbooks/screen-design.xlsx"
                  }
                },
                {
                  "col_span": 1,
                  "column": 3,
                  "coordinate": "C11",
                  "data_type": "n",
                  "row": 11,
                  "row_span": 1,
                  "source": {
                    "cell": "C11",
                    "sheet": "表紙",
                    "workbook_path": "fixtures/workbooks/screen-design.xlsx"
                  }
                },
                {
                  "col_span": 1,
                  "column": 4,
                  "coordinate": "D11",
                  "data_type": "n",
                  "row": 11,
                  "row_span": 1,
                  "source": {
                    "cell": "D11",
                    "sheet": "表紙",
                    "workbook_path": "fixtures/workbooks/screen-design.xlsx"
                  }
                },
                {
                  "col_span": 1,
                  "column": 2,
                  "coordinate": "B12",
                  "data_type": "n",
                  "row": 12,
                  "row_span": 1,
                  "source": {
                    "cell": "B12",
                    "sheet": "表紙",
                    "workbook_path": "fixtures/workbooks/screen-design.xlsx"
                  }
                },
                {
                  "col_span": 1,
                  "column": 3,
                  "coordinate": "C12",
                  "data_type": "n",
                  "row": 12,
                  "row_span": 1,
                  "source": {
                    "cell": "C12",
                    "sheet": "表紙",
                    "workbook_path": "fixtures/workbooks/screen-design.xlsx"